ThreadID,DateTime,OriginalQuestion,FinalAnswer,RetrieverCount,RewriteCount
multi-doc,20250831_223103,"Hi, I'm Alexandra.",Hello Alexandra! How can I assist you today?,0,0
multi-doc,20250831_223108,What does Xiaoshi Lu like in spare time?,"Xiaoshi Lu enjoys watching old-style movies, listening to pop music in unfamiliar languages, swimming, and hiking in her spare time.",1,0
multi-doc,20250831_223113,Tell me something about Xiaoshi Lu's relationship with Dima Bilan,"There is no information available regarding any relationship between Xiaoshi Lu and Dima Bilan. If you have any other questions or need information on a different topic, feel free to ask!",1,1
multi-doc,20250831_223120,Is Xiaoshi Lu eligible for Suncorp job?,"Based on Xiaoshi Lu's qualifications and experience as a data scientist, she appears to be a strong candidate for the Data Scientist position at Suncorp. Here's a breakdown of her alignment with the job requirements:

1. **Role Requirements and Experience**: Xiaoshi has 5 years of experience in data science, with strong skills in Python, SQL, statistical analysis, machine learning, and AI. This matches well with the technical demands of the Data Scientist role at Suncorp.

2. **Delivering Outcomes**: She has demonstrated the ability to deliver on commitments and manage complex commercial environments, which aligns with Suncorp's expectation of achieving quality and timely outcomes.

3. **Customer Focus**: Although not explicitly mentioned, her role likely involves understanding user requirements and delivering solutions, which would be beneficial for addressing Suncorp's focus on listening to customers and delivering the right outcomes.

4. **Innovation and Problem Solving**: Xiaoshi's background in developing use-cases and her proficiency in various technologies suggest she is capable of finding innovative solutions and identifying new opportunities, which is important for the role at Suncorp.

5. **Flexibility and Adaptability**: The role at Suncorp supports flexibility in work, and Xiaoshi's varied experience suggests she could adapt to different working styles and environments.

Overall, Xiaoshi Lu seems well-suited for the Data Scientist position at Suncorp, given her technical expertise, professional experience, and alignment with the key behaviors and objectives outlined in the job description.",1,1
